name,phone_numbers,officialPhone,email,websites,officialWebsite,yearEstablished,facebookLink,twitterLink,linkedinLink,instagramLink,address_line1,address_line2,address_line3,address_city,address_stateOrRegion,address_zipOrPostcode,address_country,address_countryCode,facilityTypeId,operatorTypeId,affiliationTypeIds,description,numberDoctors,capacity,specialties,procedure,equipment,capability,recency_of_page_update,distinct_social_media_presence_count,affiliated_staff_presence,custom_logo_presence,number_of_facts_about_the_organization,post_metrics_most_recent_social_media_post_date,post_metrics_post_count,engagement_metrics_n_followers,engagement_metrics_n_likes,engagement_metrics_n_engagements,latitude,longitude
Malwa Hospital,"[""+911645007500""]",+911645007500,null,"[""https://www.facebook.com/290259571569002""]",null,null,https://www.facebook.com/290259571569002,null,null,null,Power House Road,null,null,Bathinda,Punjab,151001,India,IN,hospital,null,null,"Centre of excellence in the field of Gastroenterology, Hepatology & Maternity.",null,null,"[""gastroenterology"",""gynecologyAndObstetrics"",""internalMedicine""]",[],[],"[""Centre of excellence in the field of Gastroenterology, Hepatology & Maternity"",""Open 24/7""]",null,1,TRUE,null,null,2025-01-01,null,1800,1800,null,30.20778465,74.95603943
"Trust Dental Care, Implant & Cosmetic Clinic","[""+919831499806"",""+918444999806""]",null,karanrajpaldentist@gmail.com,"[""https://clinicbooking.com/dentistry/india/west-bengal/kolkata/trust-dental-care-implant-cosmetic-clinic"",""https://www.facebook.com/1587693821461606""]",null,null,https://www.facebook.com/1587693821461606,null,null,null,"9/5, Sahapur Colony, J-block",New Alipore,null,Kolkata,West Bengal,700053,India,IN,clinic,private,null,Trust Dental Care provides you with the best dental professional treatment with the latest equi,null,null,"[""endodontics"",""familyMedicine"",""cosmeticDentistry"",""dentistry""]","[""Bad Breath Treatment"",""Dental Implants"",""Root Canals"",""Teeth Whitening"",""Extractions"",""Teeth Cleaning"",""Single Visit Root Canal"",""Dentist Consultation"",""Dental Crowns""]",null,null,null,4,FALSE,TRUE,null,null,null,null,null,null,22.51239014,88.32889557
Dr.Bharat's Multispeciality Dental Clinic,"[""+919176341803""]",+919176341803,harinibharat19@gmail.com,"[""https://www.promanage.biz/dr-bharats-multispeciality-dental-clinic/dental-clinic-in-valasaravakkam-chennai-11889893-profile"",""https://www.facebook.com/110347020396309""]",null,null,https://www.facebook.com/110347020396309,null,null,null,No.6 Alapakkam Main Road,Opp.devi Academy School,null,Chennai,Tamil Nadu,600087,India,IN,clinic,private,null,"A Renowned Multispeciality Dental Clinic, which is well equipped to handle all kinds of dental problems thereby providing quality dental treatment to all strata's of the society",null,null,"[""dermatology"",""familyMedicine"",""prosthodontics"",""endodontics"",""dentistry"",""aestheticDentistry""]","[""Performs laser-assisted root canal treatments"",""Performs root canal treatments"",""Performs esthetic procedures"",""Performs restorations"",""Performs dental implants""]",[],null,null,null,null,null,null,null,null,null,null,null,13.03939056,80.16421509
Aanchal Hospital,"[""+916266365180""]",+916266365180,null,"[""https://www.facebook.com/AanchalHospital/"",""https://www.facebook.com/100454705723669""]",null,null,https://www.facebook.com/100454705723669,null,null,null,Mahadev Ghat,Near Wood Island,Amleshwar,Amleshwar,Durg,492013,India,IN,hospital,private,null,"Aanchal Hospital providing quality healthcare and valuable experience, supported by a team of compassionate and dedicated medical professionals.",null,null,"[""nephrology"",""internalMedicine""]",[],[],"[""Aanchal Hospital provides quality healthcare and valuable experience, supported by a team of compassionate and dedicated medical professionals."",""Has 499 followers on its Facebook page"",""Provides 24/7 services"",""Has 494 likes on its Facebook page""]",null,1,TRUE,null,null,2022-03-09,1,496,494,3,21.20564651,81.57841492
Dazzle Dent,"[""+919673444856""]",+919673444856,dazzledent.dentist@gmail.com,"[""http://www.dazzledent.in/"",""https://dazzledent.in/contact.html""]",http://www.dazzledent.in/,null,https://www.facebook.com/111170653568895,null,null,null,"Flat No 18, Third Floor","Ameya Apartment, New D P Road","Near Veena World - Viva Holidays, Aundh",Pune,Maharashtra,411007,India,IN,dentist,private,null,"Dazzle Dent dental clinic offering appointments, emergency care, and general dentistry.",null,null,"[""dentistry""]",[],[],[],null,null,null,null,null,null,null,null,null,null,18.56269836,73.80293274
"Ks Homeocare - Homeopathy Clinic - Srinivas Nagara Banashankari, Bangalore","[""+919886061170""]",+919886061170,lkadhir@gmail.com,"[""https://kshomeocare.in/"",""https://kshomeocare.in/aboutus/"",""kshomeocare.com"",""http://www.kshomeocare.com/"",""https://www.facebook.com/kshomeocare.bangalore/"",""https://kshomeocare.in/contact-us/"",""kshomeocare.in"",""https://www.justdial.com/Bangalore/K-S-Homeocare-Raghavendra-Circle-Ramamurthy-Nagar/080PXX80-XX80-200701221139-L1K1_BZDET/reviews"",""https://www.ohohomeopathy.com/homeopath/ks-homeocare-homeopathy-clinic-srinivas-nagara-banashankari-bangalore-banashankari-bengaluru.php""]",kshomeocare.com,null,https://www.facebook.com/102575774557991,null,null,null,"#17/34, 1st Main Rd","Srinivasnagar, Banashankari",Ramamurthy Nagar,Bengaluru,Karnataka,560050,India,IN,clinic,private,null,"Banashankari based Ks Homeocare - Homeopathy Clinic - Srinivas Nagara Banashankari, Bangalore is a reputed homeopathy clinic run by renowned homoeopathy doctors. We treat all health problems including Hair Fall, Skin, Respiratory, Stomach Disorders, Infertility, Chronic Diseases, Psychological, Gastric Ailments, and much more. We render the best treatments in Banashankari for a host of Women and Children-related ailments as well. Contact us for a cost-effective and side-effect-free homeopathy treatment.",null,null,"[""pediatrics"",""reproductiveEndocrinologyAndInfertility"",""dermatology"",""sportsMedicinePMR"",""familyMedicine"",""pulmonology"",""nephrology"",""gastroenterology"",""otolaryngology"",""gynecologyAndObstetrics"",""rheumatology"",""psychiatry"",""headacheMedicine"",""allergyAndImmunology"",""endocrinologyAndDiabetesAndMetabolism""]","[""Conducts homeopathic consultations with thorough medical history review and examination to develop personalized treatment plans"",""Prescribes and administers specially formulated homeopathic medicines as part of treatment"",""Treats a wide range of health conditions including respiratory, digestive, skin, hormonal, musculoskeletal, mental health, and pediatric conditions""]","[""Image shows a physician holding a stethoscope and a medicine bottle"",""Photographs depict homeopathic remedy bottles (dropper bottles)""]","[""Employs an experienced team of homeopathic doctors"",""Provides personalized treatment plans based on symptoms and medical history"",""Treats digestive disorders (acidity, irritable bowel syndrome, gastritis)"",""Provides 24/7 emergency call service"",""Addresses mental and emotional well-being (anxiety, depression, stress)"",""Offers Liver Care, Kidney Care, and Skin Care treatments under homeopathy"",""Treats skin disorders (eczema, psoriasis, acne)"",""Offers outpatient homeopathy care in Bengaluru"",""Has a dedicated team of homeopathic professionals"",""Treats musculoskeletal conditions (arthritis, back pain, sports injuries)"",""Treats hormonal imbalances (PCOS, thyroid disorders, menopause symptoms)"",""Treats respiratory conditions (asthma, allergies, sinusitis)"",""Treats pediatric conditions (colic, recurrent infections, behavioral issues)""]",null,4,TRUE,null,4,null,null,null,null,null,12.93727589,77.55810547
