name,phone_numbers,officialPhone,email,websites,officialWebsite,yearEstablished,facebookLink,twitterLink,linkedinLink,instagramLink,address_line1,address_line2,address_line3,address_city,address_stateOrRegion,address_zipOrPostcode,address_country,address_countryCode,facilityTypeId,operatorTypeId,affiliationTypeIds,description,numberDoctors,capacity,specialties,procedure,equipment,capability,recency_of_page_update,distinct_social_media_presence_count,affiliated_staff_presence,custom_logo_presence,number_of_facts_about_the_organization,post_metrics_most_recent_social_media_post_date,post_metrics_post_count,engagement_metrics_n_followers,engagement_metrics_n_likes,engagement_metrics_n_engagements,latitude,longitude
Calcutta Helping Hands Clinics,"[""+918017966890""]",+918017966890,help@chhc.in,"[""https://www.facebook.com/p/Calcutta-Helping-Hands-Clinics-100063633832925/"",""http://www.chhc.in/"",""https://www.justdial.com/Kolkata/Calcutta-Helping-Hands-Clinics-Next-Chittaranjan-National-Cancer-Institute/033PXX33-XX33-240912155343-X9E8_BZDET"",""chhc.in"",""https://www.facebook.com/100063633832925/about/""]",chhc.in,null,https://www.facebook.com/103782921467836,null,null,null,"Bengal Greenfield Height, 3sc, 2nd Floor, Galaxy Complex",New Town Action Area 1,Next To Chittaranjan National Cancer Institute,Kolkata,West Bengal,700156,India,IN,clinic,null,null,Orthopaedic Hand Clinic,null,null,"[""familyMedicine""]",[],[],"[""Operates in Kolkata, West Bengal"",""Speciality orthopaedic clinic for hand and wrist problems"",""Wheelchair accessible with car parking facilities""]",null,1,FALSE,TRUE,null,2022-03-14,null,183,null,null,22.56736183,88.47058105
Ageless Smiles Dental Clinic,"[""+918451046496""]",null,null,"[""https://kivihealth.com/clinic/ageless-smiles-dental-clinic-"",""https://www.justdial.com/Mumbai/Ageless-Smiles-Dental-Clinic/022PXX22-XX22-230209182157-Z5B8_BZDET""]",null,null,https://www.facebook.com/104949789053676,null,null,null,"Ground Floor, Shri Santoshimata Society, Bhatwadi, Kaju Pada","Bhatwadi, Ghatkopar West - 84, Barve Nagar",null,Ghatkopar West,Maharashtra,400084,India,IN,clinic,private,null,Ageless Smiles Dental clinic,1,null,"[""dentistry"",""familyMedicine""]","[""Performs wisdom tooth extraction""]","[""Dental chair with attached instrument tray""]",null,null,null,null,TRUE,null,null,null,null,null,null,19.09459686,72.89990234
Dr. Vinayak Das's Clinic,"[""+918016084200"",""+919733277777"",""+916296548909""]",+918016084200,drvinayakdasquery@gmail.com,"[""https://www.drvinayakdas.com/"",""https://www.drvinayakdas.com/treatments/diagnostic-office-procedures""]",https://www.drvinayakdas.com/,null,https://www.facebook.com/104036074454597,null,null,null,"New Ramkrishna Seva Sadan, Nazrul Sarani, Pakurtala More, Ashrampara",null,null,Siliguri,West Bengal,734001,India,IN,clinic,private,null,Dr. Vinayak Das's clinic in Siliguri offering in-clinic diagnostic and office procedures for women's health.,null,null,"[""maternalFetalMedicineOrPerinatology"",""familyMedicine"",""gynecologyAndObstetrics""]","[""Laparoscopic Hysterectomy"",""Diagnostic Laparoscopy"",""Laparoscopic Myomectomy"",""Dilation and Curettage (D&C)"",""Laparoscopic Tubal Recanalization"",""Colposcopy"",""Pap Smear (Cervical Cytology)"",""Laparoscopic Surgery for Ectopic Pregnancy"",""Ectopic Pregnancy Surgery"",""Ovarian Cystectomy"",""Endometrial Biopsy"",""Laparoscopic Tubal Ligation"",""Transvaginal / Pelvic Ultrasound"",""Salpingectomy"",""Cervical Stitch Procedure"",""Myomectomy (Open or Laparoscopic)"",""Evacuation of Retained Products of Conception (ERPC)"",""Laparoscopic Ovarian Cystectomy"",""Assisted Vaginal Delivery (Vacuum / Forceps)"",""Pelvic Examination"",""Hysteroscopy"",""Hysterectomy (Abdominal / Vaginal / Laparoscopic / Robotic)"",""Laparoscopic Endometriosis Excision or Ablation"",""Laparoscopic Salpingectomy"",""Salpingo-Oophorectomy"",""Normal Vaginal Delivery (NVD)"",""Cesarean Section (C-section)"",""Manual Removal of Placenta""]","[""Laparoscopic surgical equipment for gynecological procedures"",""Ultrasound machine capable of transvaginal and pelvic ultrasound""]","[""Specializes in pregnancy management, fetal medicine, and high-risk pregnancy"",""Offers gynecologic laparoscopy and minimally invasive gynecologic surgeries including laparoscopic and robotic approaches"",""Outpatient obstetric and gynecological care with in-clinic diagnostic and office procedures"",""Most procedures are outpatient and can be completed in a single visit""]",null,4,TRUE,TRUE,null,null,null,null,null,null,26.71160316,88.42304993
Dr. Pandey's Dental and Cosmetology Clinic,"[""+919425607239""]",+919425607239,drpandeys.bhopal@gmail.com,"[""https://wa.me/917974237025"",""https://indiadental.co.in/dr-pandeys-dental-clinic/"",""https://www.facebook.com/1024804417594628"",""https://www.facebook.com/dr.pandeysdentalskinhairlaserclinic/"",""drpandeys.com""]",drpandeys.com,null,https://www.facebook.com/1024804417594628,null,null,null,41/a Opposite Tajul Masjid Royal Market,"Near General Post Office, Royal Market",Kali Basti Peer Gate Area,Bhopal,Madhya Pradesh,462001,India,IN,clinic,private,null,"Dr. Pandey's Dental and cosmetology Clinic is in Bhopal, India.",null,null,"[""cosmeticDermatology"",""familyMedicine"",""orthodontics"",""prosthodontics"",""oralAndMaxillofacialSurgery"",""dentistry"",""aestheticDentistry""]","[""Offers permanent laser hair reduction"",""Offers smile designing"",""Performs dental scaling and polishing"",""Provides crown and bridge placements"",""Offers acne treatments"",""Offers cosmetic dentistry procedures"",""Offers root canal treatment and fillings"",""Offers tattoo removal"",""Offers Hydrafacial"",""Offers mesotherapy"",""Offers dental implant planning"",""Provides dental braces and dentures"",""Offers laser carbon facial"",""Provides dental implants""]","[""State-of-the-art technology and infrastructure for dental care""]","[""Dr. Mayuri Jain Pandey holds an MDS degree"",""Led by Dr. Swapnil Pandey and Dr. Mayuri Jain Pandey"",""Dr. Mayuri Jain Pandey (MDS) and Dr. Swapnil Pandey (MDS) are doctors at the clinic"",""Offers cosmetology services including laser carbon facial, permanent laser hair reduction, tattoo removal, Hydrafacial, mesotherapy, and acne treatments"",""Located in Bhopal, Madhya Pradesh, India"",""Quality policy focused on ethical, reliable, high-quality, and cost-effective dental care through adoption of latest technology and equipment"",""Offers general dentistry, orthodontics, implants, crown and bridge, smile designing, and cosmetic dentistry procedures"",""Operates as a dental and cosmetology clinic"",""Dr. Swapnil Pandey holds an MDS degree""]",null,1,TRUE,TRUE,null,null,null,672,665,null,23.28796005,77.34669495
Dr-Hashim Raza/SMILE Maker Dental Clinic,"[""+918294593249""]",+918294593249,drhashimr@gmail.com,"[""https://www.facebook.com/883389825173297"",""https://www.facebook.com/229389230854398""]",null,null,https://www.facebook.com/229389230854398,null,null,null,Chahat Medicose,Opposite Dr P C Das Binodpur,null,Katihar,Bihar,854105,India,IN,clinic,private,null,All kind of dental solutions,null,null,"[""dentistry"",""familyMedicine""]",null,null,"[""Offers all kinds of dental solutions"",""Based in Katihar, Bihar, India""]",null,1,null,null,null,null,null,1200,1200,7,25.62045097,87.50808716
City Multispeciality Dental Clinic,"[""+919970522880"",""+919860726786""]",+919860726786,dr.irfantamboli@gmail.com,"[""http://citymultispeciality.dental-clinic.in/"",""https://www.facebook.com/101067818269689"",""citymultispeciality.dental-clinic.in"",""https://chotu.com/local/dental-clinics-in-solapur-maharashtra-india/ct-18419300/""]",citymultispeciality.dental-clinic.in,null,https://www.facebook.com/101067818269689,null,null,null,"Mahatma Phule Chowk, Station Rd, Kadlas Naka",null,null,Sangola,Maharashtra,413307,India,IN,dentist,null,null,Centre for advanced dentistry and implantology,null,null,"[""familyMedicine"",""generalDentistry"",""orthodontics"",""endodontics"",""dentistry"",""aestheticDentistry""]",[],[],"[""Offers advanced dentistry and dental implantology services"",""Operates as multispeciality dental clinic"",""Located in Sangola, Maharashtra""]",null,1,TRUE,null,null,null,null,267,265,null,17.43458176,75.18840027
Bliss Homeopathic Clinic,"[""+917990348887""]",+917990348887,beenabhadja@gmail.com,"[""https://www.practo.com/ahmedabad/clinic/bliss-homeopathic-clinic-dr-beena-bhadja-ramdev-nagar"",""https://bliss-homeopathic-clinic.vizcards.in/"",""https://www.facebook.com/blisshomeo1305/""]",https://bliss-homeopathic-clinic.vizcards.in/,null,https://www.facebook.com/106645155355213,null,null,null,"21, Shyamtirth Complex","B/s Ratnaakar Halcyon, Opp.sargam App.","Jodhpurgam, Satellite",Ahmedabad,Gujarat,380001,India,IN,clinic,private,null,"our purpose is to provide holistic way of healing , where classical homeopathic treatment for all kind of acute and chronic diseases like skin disease, gastric disease, allergic disease, child developmental disorders, gynecological dis. have been treated.",1,null,"[""familyMedicine""]",null,null,null,null,5,TRUE,FALSE,null,null,null,null,null,null,23.0185318,72.51506042
Shri Ganesh Homoeopathic Clinic Burahanapur,"[""+919179633344""]",+919179633344,dr.subodhpatil22@gmail.com,"[""https://www.facebook.com/100057828092513/posts/online-consultation-courier-services-available-book-your-appointment-highlightse/962448772359384/"",""https://www.facebook.com/1389771044415163""]",null,null,https://www.facebook.com/1389771044415163,null,null,null,1st Floor Bhagat Plaza,Pandumal Chouraha Near Bhagat Watch Company,Rajpura Road,Burhanpur,Madhya Pradesh,450331,India,IN,clinic,null,null,Online Consultation & Courier Services Available. Book Your Appointment.,null,null,"[""familyMedicine""]",[],[],"[""Operates as a homoeopathic clinic"",""Located in Burhanpur, Madhya Pradesh, India"",""Offers courier services for medication delivery"",""Offers online consultation services"",""Provides homoeopathic medical services""]",2024-10-24,1,TRUE,null,null,2024-10-24,null,714,701,null,21.30662727,76.23138428
Bamuntary Polyclinic,"[""+919707511701""]",+919707511701,mybpdc@gmail.com,"[""https://www.facebook.com/100774308387996""]",null,null,https://www.facebook.com/100774308387996,null,null,null,"Bamuntary Chariali, State Highway",null,null,Barpeta,Assam,781319,India,IN,clinic,null,null,A Multi Speciality Clinic. We believe in quality care.,null,null,"[""familyMedicine""]",null,null,null,null,null,null,null,null,null,null,null,null,null,26.35776138,90.87617493
UDAY Homoeo CARE,"[""+918106871024"",""+918096971024""]",+918106871024,null,"[""https://www.facebook.com/107894304395032"",""https://www.bharatibiz.com/en/uday-homeo-care-081068-71024""]",null,null,https://www.facebook.com/107894304395032,null,null,null,"Beside Old Reliance Petrol Bunk ,narsipatnam To Anakapalli Main Road",null,null,Narsipatnam,Andhra Pradesh,531116,India,IN,clinic,private,null,"Uday Homeo Care is a hospital in Narsipatnam, Andhra Pradesh, India. ISIC Codes: 8610.",null,null,"[""familyMedicine"",""internalMedicine""]",null,null,"[""Engaged in hospital activities"",""ISIC code 8610"",""Operates as a hospital""]",null,null,null,null,null,null,null,null,null,null,17.66189194,82.6214447
Krupa ENT Clinic,"[""+917892812082""]",+917892812082,krupaentclinic@gmail.com,"[""https://www.justdial.com/Koppal/Krupa-Ent-Clinic-Bus-Stand-Road-GANGAVATHI-Gangavathi/9999P8534-8534-221222110037-L8H5_BZDET/reviews"",""https://krupa-ent-clinic.business.site/?utm_source=gmb&utm_medium=referral"",""https://www.justdial.com/Koppal/Krupa-Ent-Clinic-Bus-Stand-Road-Gangavathi-Gangavathi/9999P8534-8534-221222110037-L8H5_BZDET"",""https://www.facebook.com/104088795923555"",""https://www.justdial.com/Koppal/ENT-Doctors-in-Gangavati-Julynagar/nct-10189442"",""krupa-ent-clinic.business.site""]",krupa-ent-clinic.business.site,null,https://www.facebook.com/104088795923555,null,null,null,Bus Stand Road,H R S Complex,Near Somaraju Hospital,Gangavathi,Karnataka,583227,India,IN,clinic,null,null,"ENT clinic near Somaraju Hospital, Gangavathi, Koppal. Opens at 10:00 AM. 2 Years in Healthcare.",null,null,"[""pediatricOtolaryngology"",""familyMedicine"",""otolaryngology"",""neurotologyAndOtology""]",[],[],"[""Has 2 years in healthcare"",""ENT clinic specializing in ear, nose, and throat care""]",null,5,TRUE,TRUE,5,2023-06-13,null,21,20,null,15.42764473,76.53144073
Akshath Dental Clinic,"[""+918508050523"",""+919363030523""]",+919363030523,[email protected],"[""https://www.akshathdentalclinic.com/""]",null,null,https://www.facebook.com/105588488885595,null,null,null,"177, Fort Main Rd",Shevapet,null,Salem,Tamil Nadu,636002,India,IN,clinic,private,null,"Akshath Dental Clinic offers orthodontics and general dentistry including aligners, braces, implants, and fillings, led by Dr. D.B Saranya.",null,null,"[""dentalImplantsAndPeriodontics"",""familyMedicine"",""orthodontics"",""prosthodontics"",""cosmeticDentistry"",""oralAndMaxillofacialSurgery"",""dentistry"",""pedodontics"",""endodontics""]","[""Offers laser dentistry"",""Provides braces including self-ligating braces"",""Offers prosthodontics"",""Offers orthodontics"",""Offers pedodontics"",""Offers cosmetic dentistry"",""Provides fillings"",""Provides dental aligners"",""Offers endodontics"",""Offers oral and maxillofacial surgery"",""Provides dental implants""]","[""Dental hygiene tools"",""Dental treatment chair"",""Dental examination equipment"",""Dental diagnostic equipment""]","[""Has 1 clinic location"",""Dr. D.B. Saranya is the primary dentist at Akshath Dental Clinic"",""Has a 5-star rating"",""Offers 20+ services"",""Provides emergency dental services"",""Has 1000+ happy patients"",""Has 15+ years of dentistry experience"",""Offers outpatient dental care""]",null,0,TRUE,TRUE,null,null,null,null,null,null,11.65325737,78.14990234
Akash Drs clinic,"[""+919388123451""]",null,null,"[""https://www.justdial.com/Palakkad/Akash-Drs-clinic/9999PX491-X491-230114161332-M4R1_BZDET"",""http://www.akashmedipharm.com/""]",http://www.akashmedipharm.com/,null,https://www.facebook.com/105474255769920,null,null,null,Palat Junction,null,null,Palakkad,Kerala,678001,India,IN,clinic,null,null,null,null,null,"[""familyMedicine""]",null,null,null,null,1,FALSE,TRUE,null,null,null,null,null,null,10.778409,76.65539551
Bhanu Hospital,"[""+919344170446""]",+919344170446,null,"[""https://www.practo.com/chennai/hospital/bhanu-hospital-thiruneermalai/services"",""https://www.facebook.com/p/Bhanu-Hospital-100064010796899/""]",null,null,https://www.facebook.com/1550262248558507,null,null,null,"No. 157, 3rd Cross Street, Sankara Nagar",Pammal,Pammal,Chennai,Tamil Nadu,600075,India,IN,hospital,null,null,24 hours maternity infertility and surgical centre,null,null,"[""internalMedicine""]",[],[],[],null,null,null,FALSE,null,null,null,null,null,null,12.97114086,80.1268158
Dr Trivedi's Health Care Clinic,"[""+919619722267""]",+919619722267,drtejastrivedi@gmail.com,"[""https://www.ohohomeopathy.com/homeopath/dr-trivedis-health-care-clinic-borivali-west-mumbai.php"",""http://www.drtrivedi.in/"",""https://www.zoominfo.com/c/dr-trivedis-health-care-clinic/1289531700"",""https://www.facebook.com/DrTHCC/"",""drtrivedi.in"",""https://www.facebook.com/1004639253035475"",""www.drtrivedi.in""]",drtrivedi.in,null,https://www.facebook.com/1004639253035475,null,null,null,Ausitorium 305 Raghuveer Towers Junction,Borivali West,null,Mumbai,Maharashtra,400092,India,IN,clinic,private,null,"We, Dr. Trivedi's Health Care Clinic, situated at Borivali West, Mumbai, Maharashtra provide perfect care to the patients with homeopathy and help them to get rid of the problem through which they are suffering from. Our objective is to deal with various health problems encountered by number of people. We are very proficient in our service. Our clinic has achieved eminence in this industry because of our clients belief and trust.Explore more",null,null,"[""familyMedicine"",""andrologyAndMaleFertility"",""dermatology"",""endocrinologyAndDiabetesAndMetabolism""]","[""Offers Vitiligo Treatment"",""Offers Migraine Treatment"",""Offers Hair Fall Treatment"",""Offers Skin Treatment"",""Offers Thyroid Treatment"",""Offers Psoriasis Treatment"",""Offers PCOS Treatment"",""Offers Eczema Treatment"",""Offers Erectile Dysfunction Treatment"",""Offers Sexual Health Treatment"",""Offers Premature Ejaculation Treatment""]",[],"[""Located in Borivali West, Mumbai, Maharashtra"",""Chief Homoeopathic Consultant and Director is Tejas Trivedi"",""Homoeopathic health care clinic"",""Based in Borivali West, Mumbai, the clinic provides homeopathy treatment for hair fall, skin, respiratory, stomach disorders, infertility, chronic diseases, psychological issues, and gastric ailments"",""Provides cost-effective and side-effect-free homeopathy treatment"",""Located in Mumbai, Maharashtra, India"",""Provides homeopathy-based care"",""Accepts multiple payment modes including cash, debit/credit cards, Paytm, Google Pay, and EMI"",""Has 11-50 employees""]",2022-02-11,1,TRUE,TRUE,null,2022-02-11,null,1000,null,null,19.23130608,72.85651398
Dr. Cherpulassery Co-Operative Hospital,"[""+914662280101""]",+914662280101,null,"[""https://www.mappls.com/place-cherpulassery+cooperative+hospital-cherppulassery-kerala-679503-w1e9qf@zdata=MTAuODc4NTU0Kzc2LjMxMzg2MysxNyt3MWU5cWYrKw==ed"",""https://www.cardiologistindia.com/kerala/cherpulassery/cherpulassery-co-operative-hospital.html""]",null,null,https://www.facebook.com/805846429514386,null,null,null,V8h7+68c Bus Stand,Akg Rd,Near Cherpulassery,Cherpulassery,Kerala,679303,India,IN,hospital,null,null,Providing exceptional cardiac care to the community,null,null,"[""cardiology"",""internalMedicine""]",[],"[""Wheelchair-accessible facilities including car park, entrance, and toilet""]","[""Operates as a general hospital"",""Offers cardiology services"",""Emergency information available for medical emergencies (911)"",""Has board-certified in Cardiology"",""Open 24 hours daily""]",null,3,TRUE,null,null,null,null,null,null,null,10.87855339,76.31385803
Rama Devi Medical Centre and Blood Bank,"[""+917080902028""]",+917080902028,rdmc.ramadevi@rediffmail.com,"[""https://www.facebook.com/104670845242214"",""https://www.facebook.com/p/Rama-Devi-Medical-Centre-and-Blood-Bank-100069199680347/""]",null,null,https://www.facebook.com/104670845242214,null,null,null,Jajmau,null,null,Kanpur,Uttar Pradesh,208010,India,IN,hospital,null,null,We are also providing International level infertility treatment.,null,null,"[""reproductiveEndocrinologyAndInfertility"",""internalMedicine""]",[],[],"[""Offers infertility treatment at an international level"",""Provides international-level infertility treatment"",""Operates 24/7""]",null,1,FALSE,null,null,2024-10-31,null,165,153,null,26.41184235,80.38671112
VIP Physio & Rehab,"[""+917068104104"",""+917048596979""]",+917048596979,null,"[""https://www.eka.care/clinic/vip-physio--rehab-53-24589006"",""https://www.justdial.com/Bhimavaram/VIP-Physio-Rehab-Tammi-Raju-Nagar-Beside-Ravindra-Commercial-Corporation-Bhimavaram-Bazar/9999P8816-8816-240426201701-X8L7_BZDET""]",null,null,https://www.facebook.com/135633342967403,null,null,null,"South Indian Bank Building, 2nd Floor","Tammi Raju Nagar, Beside Ravindra Commercial Corporation, Juvvalapalem Road, Bazar",null,Bhimavaram,Andhra Pradesh,534202,India,IN,clinic,private,null,"Neurophysiotherapy; Treatments include Neck Pain, Spinal Disorders, Low Back Pain, PIVD.",null,null,"[""familyMedicine"",""physicalMedicineAndRehabilitation""]",null,null,null,null,0,FALSE,TRUE,null,null,null,null,null,null,16.71232986,81.1006012
Agrawal Neuro Healthcare,"[""+918630320857""]",+918630320857,drprinceneuromtr@gmail.com,"[""https://www.justdial.com/Mathura/Agrawal-Neuro-Healthcare-Dr-Prince-Agrawal-Krishna-Nagar/9999PX565-X565-240131212921-C4H5_BZDET"",""drprinceagrawal.com"",""https://www.facebook.com/179482471920690"",""http://www.drprinceagrawal.com/"",""https://www.justdial.com/Mathura/Agrawal-Neuro-Healthcare-Dr-Prince-Agrawal/9999PX565-X565-240221160327-W2Z9_BZDET"",""https://www.facebook.com/agrawalneurohealthcare/""]",drprinceagrawal.com,null,https://www.facebook.com/179482471920690,null,null,https://instagram.com/agrawalneurohealthcare,Near Vipin Nursing Home,Krishna Nagar,null,Mathura,Uttar Pradesh,281004,India,IN,clinic,private,null,"Neurology practice providing personalized neurological assessments, innovative treatments, and holistic patient care.",null,null,"[""neurology"",""clinicalNeurophysiology"",""sleepMedicineNeurology"",""familyMedicine"",""movementDisorders"",""psychiatry"",""neurosurgery"",""headacheMedicine"",""epilepsyNeurology""]",[],"[""Shows a stethoscope in practice photos""]","[""Specializes in diseases of brain, spine, nerve and muscles"",""Neurology practice providing personalized neurological assessments, innovative treatments, and holistic patient care"",""Offers online appointment booking/consultation via external platform (hplix.in)"",""Located in Mathura, Uttar Pradesh"",""Staff includes Dr Prince Agrawal, DM Neurophysician (GB Pant Hospital, New Delhi)""]",null,3,TRUE,TRUE,null,null,null,null,null,null,27.49572182,77.65989685
Spark Diagnostics,"[""+912534056777"",""+912536667777""]",+912536667777,manager@sparkdiagnostics.in,"[""https://www.facebook.com/100522679548326"",""https://www.justdial.com/Nashik/Spark-Diagnostics-Cidco/0253PX253-X253-190324112240-G6H3_BZDET""]",null,null,https://www.facebook.com/100522679548326,null,null,null,"Sai Krupa, Kashyape Clinics, Chandak Circle.",Cidco,null,Nashik,Maharashtra,422009,India,IN,clinic,private,null,Advanced Diagnostic Centre for Radiology and Laboratory – tests.,null,null,"[""pathology"",""familyMedicine"",""radiology""]",[],[],[],null,0,FALSE,FALSE,null,null,null,null,null,null,19.9924736,73.77624512
Dr Pooja Aggarwal Pediatrician Clinic,"[""09927166995""]",null,null,"[""https://drpoojaagarwal.getmy.clinic/"",""https://www.mappls.com/place-dr+pooja+aggarwal+pediatrician-balaji+hospital+rampur+road-samta+ashram+gali-near+agrasen+dharamshala-haldwani-uttarakhand-263139-90opub@zdata=MjkuMjA3Njg1Kzc5LjUyMjc4NSsxNys5MG9wdWIrKw==ed""]",https://drpoojaagarwal.getmy.clinic/,null,null,null,null,null,Balaji Hospital Rampur Road,Samta Ashram Gali,Near Agrasen Dharamshala,Haldwani,Uttarakhand,263139,India,IN,clinic,null,null,Dr Pooja Aggarwal Pediatrician Clinic,null,null,"[""familyMedicine""]",null,null,null,null,null,null,null,null,null,null,null,null,null,29.20768356,79.522789
Shri Dhanvantari Clinic,"[""+918077830282""]",+918077830282,shridhanvantariclinic0223@gmail.com,"[""https://www.facebook.com/108701572193044"",""https://www.practo.com/dehradun/clinic/shri-dhanvantari-clinic-dehradun/ayurveda-ps-4""]",null,null,https://www.facebook.com/108701572193044,null,null,null,A P Bahuguna,Garhwali Colony,Near Indian Academy School,Dehradun,Uttarakhand,248001,India,IN,clinic,private,null,"Shri Dhanvantari Clinic is an Ayurveda Clinic in Garhwali Colony, Dehradun. The clinic is visited by ayurvedic practitioner like Dr. Shashank Rawat. The timings of Shri Dhanvantari Clinic are: Mon-Sat: 10:00-19:00. Some of the services provided by the Clinic are: Ayurvedic General Medicine,Ayurveda Practitioner and Kayachikitsa (General Ayurveda Treatments) etc.",1,null,"[""familyMedicine""]",null,null,null,null,null,TRUE,null,null,null,null,null,null,null,30.29880142,78.07276917
Krishna Heart Care and Maternity Home,"[""+917081565194""]",+917081565194,gagnendra.zydus@gmail.com,"[""https://www.justdial.com/Jaunpur/X-Ray-Centres-for-Health-Screening/nct-10544418-att-hos285"",""https://www.facebook.com/krishnaheartcare/"",""https://www.justdial.com/Jaunpur/Krishna-Heart-Care-Krishna-Nagar-Near-Jaycees-Chauraha-Jaunpur-Kutchery/9999P5452-5452-191109124604-L3X2_BZDET"",""https://www.365doctor.in/best-doctor/top-7-gynecologist-in-jaunpur-according-to-users-reviews"",""https://www.facebook.com/2094532300758729"",""https://www.justdial.com/Jaunpur/Krishna-Heart-Care-And-Infertility-Center-Olandganj/9999P5452-5452-200927210900-G6N8_BZDET"",""krishnaheartinfertility.com"",""https://www.onefivenine.com/india/Listing/Locality/hospitals/Jaunpur/Jaunpur/Mainpur"",""https://www.latlong.net/poi/krishna-heart-care-and-maternity-home-381598""]",krishnaheartinfertility.com,null,https://www.facebook.com/108020997224024,null,null,null,"Krishna Nagar, Near Jaycees Chauraha",Kutchery,null,Jaunpur,Uttar Pradesh,222002,India,IN,hospital,private,null,Hospital,null,null,"[""reproductiveEndocrinologyAndInfertility"",""obstetricsAndMaternityCare"",""familyMedicine"",""cardiology"",""gynecologyAndObstetrics"",""internalMedicine""]","[""Cardiac catheterization services offered via Cath Lab""]","[""Catheterization laboratory (Cath Lab) facility"",""Wheelchair-accessible car parking"",""Wheelchair-accessible entrance and exit""]","[""Official website available at http://krishnaheartinfertility.com/about_us.html"",""Operates 24/7"",""Provides 24/7 emergency care"",""Specializes in heart care and infertility services"",""Maintains a blood bank facility"",""Hospital located in Jaunpur, Uttar Pradesh"",""Cath Lab facility at Krishna Heart Care"",""Located in Olandganj, Jaunpur, Uttar Pradesh""]",null,1,TRUE,FALSE,null,null,null,null,null,null,25.74507904,82.68237305
Dr Vibha Verma,"[""+919431047294""]",null,null,"[""https://gynecologistnearme.in/city/muzaffarpur/""]",null,null,https://www.facebook.com/101614643752289,null,null,null,Near Rd Number 2 Juran Chapra And Behind Maripur Overbridge,Imlichatti Rd,null,Muzaffarpur,Bihar,842001,India,IN,doctor,null,null,"MBBS, MD (Obstetrics & Gynecology)",null,null,"[""gynecologyAndObstetrics""]",[],[],"[""Credentials: MBBS, MD (Obstetrics & Gynecology)"",""Located in Muzaffarpur, Bihar, India"",""Specializes in Gynecology and Obstetrics""]",null,0,TRUE,FALSE,32,null,null,null,null,null,26.12919807,85.37519836
